title,company,location,created,salary_min,salary_max,description,redirect_url,search_role,search_country
Senior Machine Learning Engineer,Omnis Partners,"London, UK",2025-05-08T06:56:35Z,66892.34,66892.34," Hiring: Snr. Databricks ML Engineer  Remote (UK-based) |  Up to £110,000 We’re working with a cutting-edge AI consultancy who are scaling their ML team with a key hire: a Senior Databricks ML Engineer who’s as comfortable in pre-sales conversations as they are deploying models to production.  You’ll be someone who: Has deep ML theory knowledge — ideally a PhD/postdoc in AI/ML Knows when not to use a model based on cost vs. impact Advocates for AI productivity tools and uses them daily Is comme…",https://www.adzuna.co.uk/jobs/land/ad/5187948745?se=oC6x9biE8BGkMMRxZtLABA&utm_medium=api&utm_source=d8fd1a4d&v=1BBB25FD2645240CCBE0F4B260D6DD3732D70EDC,machine learning engineer,gb
Senior Machine Learning Engineer,Omnis Partners,"The City, Central London",2025-06-13T19:24:32Z,67707.45,67707.45," Hiring: Snr. Databricks ML Engineer  Remote (UK-based) |  Up to £110,000 We’re working with a cutting-edge AI consultancy who are scaling their ML team with a key hire: a Senior Databricks ML Engineer who’s as comfortable in pre-sales conversations as they are deploying models to production.  You’ll be someone who: Has deep ML theory knowledge — ideally a PhD/postdoc in AI/ML Knows when not to use a model based on cost vs. impact Advocates for AI productivity tools and uses them daily Is comme…",https://www.adzuna.co.uk/jobs/land/ad/5249081662?se=oC6x9biE8BGkMMRxZtLABA&utm_medium=api&utm_source=d8fd1a4d&v=22F5544BEDA3A7FD289F8A71E6D883DFB3016901,machine learning engineer,gb
Machine Learning Engineer,Fortice Ltd,"Manchester, Greater Manchester",2025-08-14T21:16:51Z,9100.0,156000.0,"Machine Learning Software Engineer Contract ?? London or Manchester | Hybrid (80% on-site) ?? Up to £600 per day | Inside IR35 ?? DV Clearance Required Were working with a leading consultancy on a Machine Learning Software Engineer contract, delivering high-impact projects in secure government environments. Youll bring: Python and/or JavaScript/TypeScript experience, strong AWS skills, Kubernetes, CI/CD, and experience with data platforms, high-volume processing, API development, and Terraform.…",https://www.adzuna.co.uk/jobs/land/ad/5352656937?se=oC6x9biE8BGkMMRxZtLABA&utm_medium=api&utm_source=d8fd1a4d&v=824F6B7D5039DC541EBFD196D95DD16DE3779E6C,machine learning engineer,gb
Machine Learning Engineer,Stepstone UK,"South Bank, South East London",2025-08-18T21:42:12Z,65039.46,65039.46,"Company Description At The Stepstone Group, we have a simple yet very important mission: The right job for everyone. Using our data, platform, and technology, we create opportunities for jobseekers and companies around the world to find a perfect match in fair and equitable way. With over 20 brands across 30 countries, we strive for fair and unbiased hiring. Join our team of 4,000 employees and be part of reshaping the labour market and becoming the worlds leading job platform. Job Description …",https://www.adzuna.co.uk/jobs/land/ad/5357652665?se=oC6x9biE8BGkMMRxZtLABA&utm_medium=api&utm_source=d8fd1a4d&v=7AA7DF386F0EE5104C26D6AEE6492D8EEAF7E537,machine learning engineer,gb
Machine Learning Engineer - Computer Vision,Explore Group,"London, UK",2025-08-20T07:17:18Z,69523.74,69523.74,"6 Month Contract - Hybrid Working - Asap Start - Outside of IR-35 Overview The Explore Group are working with one of our tier 1 clients in securing an experienced Machine Learning Engineer with strong expertise in Computer Vision to join our team on a 6 month initial contract (with guaranteed extensions). You will play a key role in designing, building, and deploying machine learning models that drive innovation in image and video processing. Responsibilities Develop, train, and optimise comput…",https://www.adzuna.co.uk/jobs/land/ad/5359788129?se=oC6x9biE8BGkMMRxZtLABA&utm_medium=api&utm_source=d8fd1a4d&v=EF11CCCABBCC10696B9530DF42BF85BFA2A6EFD5,machine learning engineer,gb
Machine Learning Engineer - Computer Vision,Explore Group,"The City, Central London",2025-08-22T03:49:14Z,70370.71,70370.71,"6 Month Contract - Hybrid Working - Asap Start - Outside of IR-35 Overview The Explore Group are working with one of our tier 1 clients in securing an experienced Machine Learning Engineer with strong expertise in Computer Vision to join our team on a 6 month initial contract (with guaranteed extensions). You will play a key role in designing, building, and deploying machine learning models that drive innovation in image and video processing. Responsibilities Develop, train, and optimise comput…",https://www.adzuna.co.uk/jobs/land/ad/5363157801?se=oC6x9biE8BGkMMRxZtLABA&utm_medium=api&utm_source=d8fd1a4d&v=BCE54531D0E679A774B978398E4370BC6C44AEE1,machine learning engineer,gb
Graduate AI & Machine Learning Engineer - Reply,Reply,"London, UK",2025-08-21T13:47:52Z,46879.01,46879.01,"Graduate AI and Machine Learning Engineer About Data Reply: DATA REPLY are data specialists, offering data platforms, BI, advanced analytics and AI/Machine Learning (ML) solutions to drive business success. We specialise in developing, deploying and operating production data solutions on AWS cloud. www.data.reply.com Role overview: As a Graduate AI & Machine Learning Engineer, you'll assist our team in the design and development of machine learning processes in a variety of client environments.…",https://www.adzuna.co.uk/jobs/land/ad/5361946357?se=oC6x9biE8BGkMMRxZtLABA&utm_medium=api&utm_source=d8fd1a4d&v=8ACB4537486C1C44140DE711E182799A90BAE3CD,machine learning engineer,gb
Lead Machine Learning Engineer - Databricks experience,ON Data Staffing,UK,2025-08-20T07:19:19Z,56090.25,56090.25,"ON Data Staffing is currently seeking a talented Machine Learning Engineer with expertise in Databricks to join our client's remote team in the United Kingdom. As a key member of our client's Data Science and Machine Learning team, the Databricks ML Engineer will play a crucial role in developing and implementing state-of-the-art machine learning models and algorithms to solve complex business problems. This is an exciting opportunity to work with cutting-edge technologies and make a significan…",https://www.adzuna.co.uk/jobs/land/ad/5359788997?se=oC6x9biE8BGkMMRxZtLABA&utm_medium=api&utm_source=d8fd1a4d&v=C5A2CC3C381F435911193A77D9CB8D54D2E85402,machine learning engineer,gb
Machine Learning Engineer,Talent Hero,"Birmingham, West Midlands",2025-06-25T10:08:33Z,59000.0,62000.0,"Machine Learning Engineer – Remote (UK Only | No Visa Sponsorship) Work on AI Products for US Tech Companies Talent Hero helps UK-based professionals land remote roles with innovative US businesses. We're hiring Machine Learning Engineers to build and deploy production-grade ML systems that solve real-world problems at scale. If you're experienced with model design, training, and deployment — and want to work globally from home — we want to hear from you. What You’ll Do: Build and deploy machin…",https://www.adzuna.co.uk/jobs/details/5267032490?utm_medium=api&utm_source=d8fd1a4d,machine learning engineer,gb
Machine Learning Engineer,Talent Hero,"Hulme, Manchester",2025-07-27T23:10:40Z,59000.0,62000.0,"Machine Learning Engineer – Remote (UK Only | No Visa Sponsorship) Work on AI Products for US Tech Companies Talent Hero helps UK-based professionals land remote roles with innovative US businesses. We're hiring Machine Learning Engineers to build and deploy production-grade ML systems that solve real-world problems at scale. If you're experienced with model design, training, and deployment — and want to work globally from home — we want to hear from you. What You’ll Do: Build and deploy machin…",https://www.adzuna.co.uk/jobs/details/5324770967?utm_medium=api&utm_source=d8fd1a4d,machine learning engineer,gb
Machine Learning Engineer,Ravelin,"London, UK",2025-08-26T18:12:32Z,43047.82,43047.82,"Who are we? Hi!  We are Ravelin! We're a fraud detection company using advanced machine learning and network analysis technology to solve big problems. Our goal is to make online transactions safer and help our clients feel confident serving their customers. And we have fun in the meantime! We are a friendly bunch and pride ourselves in having a strong culture and adhering to our values of empathy, ambition, unity, and integrity. We really value work/life balance and we embrace a flat hierarchy…",https://www.adzuna.co.uk/jobs/details/5368978424?utm_medium=api&utm_source=d8fd1a4d,machine learning engineer,gb
Machine Learning Engineer,Rebellion,"Oxford, Oxfordshire",2025-08-22T11:37:48Z,35638.44,35638.44,"We want you to JOINTHEREBELLION! For 30 years we’ve been independently developing and publishing incredible video games at our multiple studios founded by Jason & Chris Kingsley, but Rebellion is more than just games. We have our own film studio, we create board games, publish books, and through 2000AD, publish comics and graphic novels such as the amazing Judge Dredd. We’re seeking a skilled and innovative Machine Learning Engineer to join our cutting-edge ML Team. You’ll be part of a small, h…",https://www.adzuna.co.uk/jobs/details/5363421373?utm_medium=api&utm_source=d8fd1a4d,machine learning engineer,gb
Machine Learning Engineer,Sanderson Recruitment,"London, UK",2025-08-09T00:26:50Z,182000.0,195000.0,"Machine Learning Engineer £700-750/day overall assignment rate to umbrella Fully remote 6 month initial A FTSE 100 retail client are on the look for a Data Scientist/Machine Learning Engineer to join their data science function to drive cutting-edge ML technology across the business. Machine Learning Engineer, key skills: Significant experience working as a Data Scientist/Machine Learning Engineer Solid knowledge of SQLandPython's ecosystem for data analysis (Jupyter, Pandas, Scikit Learn, Matp…",https://www.adzuna.co.uk/jobs/details/5344740951?utm_medium=api&utm_source=d8fd1a4d,machine learning engineer,gb
Machine Learning Engineer,Networker Global Limited,UK,2025-07-29T03:46:30Z,104000.0,182000.0," Machine Learning Engineer Remote (Contract) Day Rate: £400 - £700 Duration: 6 months IR35: Outside Scope Overview Are you a talented Machine Learning Engineer eager to tackle exciting projects and make a significant impact in the tech industry? We are seeking experienced machine learning professionals for project-based work with leading organizations across various sectors. Through Myn's recruitment platform, you'll have the opportunity to: - Develop and implement cutting-edge machine learning…",https://www.adzuna.co.uk/jobs/details/5326124810?utm_medium=api&utm_source=d8fd1a4d,machine learning engineer,gb
Machine Learning Engineer,Argo Recruitment Services,"Bristol, South West England",2024-07-31T15:02:27Z,56407.49,56407.49,"Fast becoming one of the world leaders in Machine Learning. My client is seeking a number of Machine Learning Engineers for their growing team. You will have a background in Machine Learning development or a background working in HPC. It will also be advantageous if you have worked with compilers, DSPs or GPUs. Preferably you will have a C/C++ background to co-inside with your Machine Learning experience. Please do get in touch so I can tell you more.",https://www.adzuna.co.uk/jobs/details/4802501637?utm_medium=api&utm_source=d8fd1a4d,machine learning engineer,gb
Machine Learning Engineer,Argo Recruitment Services,"Cambridge, Cambridgeshire",2024-08-02T15:02:33Z,58461.51,58461.51,"Fast becoming one of the world leaders in Machine Learning. My client is seeking a number of Machine Learning Engineers for their growing team. You will have a background in Machine Learning development or a background working in HPC. It will also be advantageous if you have worked with compilers, DSPs or GPUs. Preferably you will have a C/C++ background to co-inside with your Machine Learning experience. Please do get in touch so I can tell you more.",https://www.adzuna.co.uk/jobs/details/4807167210?utm_medium=api&utm_source=d8fd1a4d,machine learning engineer,gb
Machine Learning Engineer,Fathom,"Tyndalls Park, Bristol",2025-08-13T21:02:19Z,33544.8,33544.8,"Machine Learning Engineer Location: Commutable distance for either Bristol or London offices Salary: competitive salary and excellent benefits. Fathom is a leading water intelligence company leveraging cutting-edge machine learning to transform how we understand and manage water systems. We develop ML approaches such as diffusion, pixelwise regression, sensor fusion and GNNs to create DEMs, regionalise our data, predict riverflow and downscale climate data. As we expand our in-house ML capabili…",https://www.adzuna.co.uk/jobs/details/5350891985?utm_medium=api&utm_source=d8fd1a4d,machine learning engineer,gb
Machine Learning Engineer,Cobalt Recruitment.,"London, UK",2025-08-21T22:47:26Z,80000.0,80000.0,"About the Company You'll be joining a global leader in commercial real estate services and investment management. Known for combining deep market expertise with innovative technology, the business is committed to modernising how investment decisions are made. You'll be part of a collaborative, forward-thinking environment where your contributions will directly shape the future of real estate technology. Role Responsibilities Design, develop, and implement generative AI and machine learning solu…",https://www.adzuna.co.uk/jobs/details/5362812101?utm_medium=api&utm_source=d8fd1a4d,machine learning engineer,gb
Machine Learning Engineer,Optimove,"London, UK",2025-03-18T17:00:59Z,52240.44,52240.44,"Optimove is a global marketing tech company, recognized as a Leader by Forrester and a Challenger by Gartner. We work with some of the world's most exciting brands, such as Sephora, Staples, and Entain, who love our thought-provoking combination of art and science. With a strong product, a proven business, and the DNA of a vibrant, fast-growing startup, we're on the cusp of our next growth spurt. It's the perfect time to join our team of ~500 thinkers and doers across NYC, LDN, TLV, and other l…",https://www.adzuna.co.uk/jobs/details/5099176862?utm_medium=api&utm_source=d8fd1a4d,machine learning engineer,gb
Machine Learning Engineer,Faculty AI,"London, UK",2025-08-08T11:27:45Z,66929.87,66929.87,"About Faculty At Faculty, we transform organisational performance through safe, impactful and human-centric AI. With more than a decade of experience, we provide over 350 global customers with software, bespoke AI consultancy , and Fellows from our award winning Fellowship programme . Our expert team brings together leaders from across government, academia and global tech giants to solve the biggest challenges in applied AI. Should you join us, you’ll have the chance to work with, and learn fro…",https://www.adzuna.co.uk/jobs/details/5343498797?utm_medium=api&utm_source=d8fd1a4d,machine learning engineer,gb
Machine Learning Engineer,CoVar,UK,2024-08-10T15:15:11Z,54988.52,54988.52,"Machine Learning Engineer About CoVar CoVar is a small AI/ML R&D software company in Durham, NC, that uses artificial intelligence to solve problems that matter. We develop AI/ML tools to help the DoD detect enemies and threats, help biomedical researchers find new cures for diseases, and help monitor machinery to prevent injuries and environmental catastrophes. We are passionate engineers, dedicated to pushing the bounds of what AI/ML can do in the real world. About this position You will help…",https://www.adzuna.co.uk/jobs/details/4820163782?utm_medium=api&utm_source=d8fd1a4d,machine learning engineer,gb
Machine Learning Engineer,hackajob,"Welwyn Garden City, Hertfordshire",2025-08-14T20:57:11Z,56326.0,56326.0,"hackajob is collaborating with Tesco to connect them with exceptional tech professionals for this role. Tesco UK Welwyn Garden City Full-Time About The Role Within Tesco Data & Analytics, we help our customers and the communities where we operate get the most value from data. We build and run Tesco’s data platforms, we architect and engineer data onto these platforms, provide capabilities and tools to the analytics community across Tesco, and develop data products at scale. Our Data Science tea…",https://www.adzuna.co.uk/jobs/details/5352638975?utm_medium=api&utm_source=d8fd1a4d,machine learning engineer,gb
Machine Learning Engineer,G-Research,"London, UK",2025-07-02T16:50:25Z,46846.43,46846.43,"Do you want to tackle the biggest questions in finance with near infinite compute power at your fingertips? G-Research is a leading quantitative research and technology firm, with offices in London and Dallas. We are proud to employ some of the best people in their field and to nurture their talent in a dynamic, flexible and highly stimulating culture where world-beating ideas are cultivated and rewarded. This is a role based in our new Soho Place office – opened in 2023 - in the heart of Centr…",https://www.adzuna.co.uk/jobs/details/5280153866?utm_medium=api&utm_source=d8fd1a4d,machine learning engineer,gb
Machine Learning Engineer,Barlowe LLP,"London, UK",2025-01-15T12:41:19Z,42404.8,42404.8,"Do you want to tackle the biggest questions in finance with near infinite compute power at your fingertips? G-Research is a leading quantitative research and technology firm, with offices in London and Dallas. We are proud to employ some of the best people in their field and to nurture their talent in a dynamic, flexible and highly stimulating culture where world-beating ideas are cultivated and rewarded. This is a role based in our new Soho Place office – opened in 2023 - in the heart of Centr…",https://www.adzuna.co.uk/jobs/details/5011395406?utm_medium=api&utm_source=d8fd1a4d,machine learning engineer,gb
Machine Learning Engineer,Corsearch,"St Paul's, Central London",2025-08-02T20:29:10Z,57456.98,57456.98,"At Corsearch, we are dedicated to creating a world where consumers can trust the choices they make. As a global leader in Trademark and Brand Protection, we partner with businesses to safeguard their most valuable assets in an increasingly complex digital environment. Our comprehensive solutions, powered by AI-driven data and deep analytics, enable brands to establish, monitor, and protect their presence against infringement and counterfeiting. Why Choose Corsearch? Innovative Solutions : We co…",https://www.adzuna.co.uk/jobs/details/5334743855?utm_medium=api&utm_source=d8fd1a4d,machine learning engineer,gb
Machine Learning Engineer,Snap Group Limited,"London, UK",2025-08-24T11:27:41Z,42191.98,42191.98,"Snap Inc is a technology company. We believe the camera presents the greatest opportunity to improve the way people live and communicate. Snap contributes to human progress by empowering people to express themselves, live in the moment, learn about the world, and have fun together. The Company’s three core products are Snapchat , a visual messaging app that enhances your relationships with friends, family, and the world; Lens Studio , an augmented reality platform that powers AR across Snapchat…",https://www.adzuna.co.uk/jobs/details/5366508805?utm_medium=api&utm_source=d8fd1a4d,machine learning engineer,gb
Machine Learning Engineer,Graphcore,"London, UK",2024-11-24T10:55:42Z,53030.48,53030.48,"As a Machine Learning Engineer in the Applied AI team at Graphcore, you will contribute to advancing AI technology by developing and optimising AI models tailored to our specialised hardware. Working closely with the Software development and Research teams, you will play a critical role in finding opportunities to innovate and differentiate Graphcore’s technology. We seek engineers with strong technical skills and an understanding of AI model implementation, eager to make a tangible impact in t…",https://www.adzuna.co.uk/jobs/details/4949626450?utm_medium=api&utm_source=d8fd1a4d,machine learning engineer,gb
Machine Learning Engineer,Graphcore,"London, UK",2025-08-07T11:27:10Z,53690.75,53690.75,"As a Machine Learning Engineer in the Applied AI team at Graphcore, you will contribute to advancing AI technology by developing and optimising AI models tailored to our specialised hardware. Working closely with the Software development and Research teams, you will play a critical role in finding opportunities to innovate and differentiate Graphcore’s technology. We seek engineers with strong technical skills and an understanding of AI model implementation, eager to make a tangible impact in t…",https://www.adzuna.co.uk/jobs/details/5341692550?utm_medium=api&utm_source=d8fd1a4d,machine learning engineer,gb
Machine Learning Engineer,Graphcore,"Bristol, South West England",2025-08-07T11:33:22Z,51444.8,51444.8,"As a Machine Learning Engineer in the Applied AI team at Graphcore, you will contribute to advancing AI technology by developing and optimising AI models tailored to our specialised hardware. Working closely with the Software development and Research teams, you will play a critical role in finding opportunities to innovate and differentiate Graphcore’s technology. We seek engineers with strong technical skills and an understanding of AI model implementation, eager to make a tangible impact in t…",https://www.adzuna.co.uk/jobs/details/5341695764?utm_medium=api&utm_source=d8fd1a4d,machine learning engineer,gb
Machine Learning Engineer,Graphcore,"Cambridge, Cambridgeshire",2025-08-07T11:28:27Z,52036.92,52036.92,"As a Machine Learning Engineer in the Applied AI team at Graphcore, you will contribute to advancing AI technology by developing and optimising AI models tailored to our specialised hardware. Working closely with the Software development and Research teams, you will play a critical role in finding opportunities to innovate and differentiate Graphcore’s technology. We seek engineers with strong technical skills and an understanding of AI model implementation, eager to make a tangible impact in t…",https://www.adzuna.co.uk/jobs/details/5341693215?utm_medium=api&utm_source=d8fd1a4d,machine learning engineer,gb
Machine Learning Engineer,TD Bank,"Toronto, Ontario",2025-08-23T17:42:44Z,,,"Work Location: Toronto, Ontario, Canada Hours: 37.5 Line of Business: Analytics, Insights, & Artificial Intelligence Pay Details: $120,000 - $190,000 CAD The pay details posted reflect a temporary market premium specific to this role that is reassessed annually. TD is committed to providing fair and equitable compensation opportunities to all colleagues. Growth opportunities and skill development are defining features of the colleague experience at TD. Our compensation policies and practices ha…",https://www.adzuna.ca/land/ad/5366010192?se=1ARa97iE8BGkMMRxZtLABA&utm_medium=api&utm_source=d8fd1a4d&v=B2EF00087F632E9E459722936E37C88558D1FE03,machine learning engineer,ca
Machine Learning Engineer,Your Personal AI,Canada,2025-08-25T10:14:46Z,,,"We are looking for a highly skilled and innovative Machine Learning Engineer to join our dynamic team at Your Personal AI . In this role, you will be responsible for designing, developing, and deploying state-of-the-art machine learning models that drive the core of our AI-driven solutions. You will collaborate closely with cross-functional teams to identify challenges, create scalable algorithms, and implement machine learning systems that solve real-world problems. Machine Learning Engineer a…",https://www.adzuna.ca/details/5367496709?utm_medium=api&utm_source=d8fd1a4d,machine learning engineer,ca
Machine Learning Engineer,Quincus,"Toronto, Ontario",2024-07-30T17:37:53Z,,,"“Make every logistics journey your best one yet” The Company. Founded in 2014, Quincus is a B2B supply chain operating SaaS platform headquartered in Singapore. We solve today's global supply chain challenges with groundbreaking technology. Using AI and machine learning, we have digitized and optimized the logistics process while giving customers full transparency into their supply chain. Quincus was founded by two visionary entrepreneurs who possess more than a decade of experience in tech. Ch…",https://www.adzuna.ca/details/4801466889?utm_medium=api&utm_source=d8fd1a4d,machine learning engineer,ca
Machine Learning Engineer,Demand For HR,"Toronto, Ontario",2025-07-11T15:17:22Z,,,"Our client is looking for a highly skilled Machine Learning Engineer to join their growing team in Mississauga. This role is ideal for a technically strong and experienced ML professional who thrives in a fast-paced, collaborative environment and is passionate about delivering scalable machine learning solutions on distributed systems such as Hadoop. Key Responsibilities: Design, develop, and implement machine learning models using Spark ML for predictive analytics Build and optimize end-to-end…",https://www.adzuna.ca/details/5298014952?utm_medium=api&utm_source=d8fd1a4d,machine learning engineer,ca
Machine Learning Engineer,Demand For HR,"Toronto, Ontario",2025-08-08T07:08:12Z,,,"Job Description Job Description Our client is looking for a highly skilled Machine Learning Engineer to join their growing team in Mississauga. This role is ideal for a technically strong and experienced ML professional who thrives in a fast-paced, collaborative environment and is passionate about delivering scalable machine learning solutions on distributed systems such as Hadoop. Key Responsibilities: Design, develop, and implement machine learning models using Spark ML for predictive analyti…",https://www.adzuna.ca/details/5343539255?utm_medium=api&utm_source=d8fd1a4d,machine learning engineer,ca
