title,company,location,created,salary_min,salary_max,description,redirect_url,search_role,search_country
Business Analyst,Procom,"Greater Vancouver, British Columbia",2025-08-22T06:52:51Z,,,"Business Analyst: On behalf of our worker's compensation client, Procom is searching for a Business Analyst for a 12-month role. This position is a hybrid position with 3 days onsite at our client’s Richmond office. Business Analyst - Job Description: The Business Analyst will be responsible for delivering core BA services, project management, and change management. The role involves facilitating meetings, both in-person and virtually, to support various projects within the organization. Busine…",https://www.adzuna.ca/details/5363424149?utm_medium=api&utm_source=d8fd1a4d,business analyst,ca
Business Analyst,Procom,"Calgary, Calgary region",2025-08-10T07:45:21Z,,,"Business Analyst: On behalf of our Corporate client, Procom is searching for a Business Analyst for a 5 month contract. This position is a hybrid position with 3 days onsite at our client’s Calgary office. Business Analyst - Job Description: We are seeking a detail-oriented and proactive Business Analyst to support Real Estate and Governance activities within the REWS Team. The role involves portfolio management, lease management, and accounting, as well as project planning and data management …",https://www.adzuna.ca/details/5346703620?utm_medium=api&utm_source=d8fd1a4d,business analyst,ca
Business Analyst,Virtusa,"Toronto, Ontario",2025-08-06T05:24:29Z,,,"P2-C2-STSBusiness AnalystPrimary SkillsStrong Business Analyst KnowledgeAgile, Credit Risk (Risk Model understanding, Risk metrics), regulations (Basel, BCAR, RWA) experienceStrong CommunicationJDExamining the business needs to determine the testing technique by automation testing.Maintenance of present regression suites and test scripts is an important responsibility of the tester.The testers must attend agile meetings for backlog refinement, sprint planning, and daily scrum meetings.Testers t…",https://www.adzuna.ca/details/5339712994?utm_medium=api&utm_source=d8fd1a4d,business analyst,ca
Business Analyst,Workhoppers,"Hamilton region, Ontario",2025-07-04T06:52:12Z,,,"The company, a national IT consulting company, is seeking a Business Analyst to support business requirements gathering, documentation, data analysis, and testing efforts for the implementation of Workday Financials (FINS) and Procurement (P2P). This implementation marks the second platform in the rollout of the Workday enterprise resource planning system. Workday Strategic Sourcing is currently being implemented, and the full implementation of Workday Enterprise Resource Planning will include …",https://www.adzuna.ca/details/5284261833?utm_medium=api&utm_source=d8fd1a4d,business analyst,ca
Business Analyst,Parrish and Heimbecker,"Cambridge, Waterloo region",2025-08-02T02:22:25Z,,,"Job Description Job Description Business Analyst Parrish & Heimbecker Join our team that shares your Passion & Heart for Canadian agriculture! Parrish & Heimbecker, Limited (P&H) has an opportunity for a motivated, forward-thinking, and dedicated individual as a Business Analyst based in Cambridge or Guelph, Ontario.Work and grow with a family-owned company. P&H’s roots go back over 110 years. We have always been a Canadian, family-owned and managed agri-business that understands the qualities …",https://www.adzuna.ca/details/5334029091?utm_medium=api&utm_source=d8fd1a4d,business analyst,ca
Business Analyst,Aquent,Canada,2025-08-20T06:51:18Z,,,"This Business Analyst role is crucial for maintaining the accuracy and integrity of our client’s data within their financial services cloud instance. The primary function of this role is to research, verify, and upload contact information, with a focus on external contacts in the insurance and financial industry. This position requires a meticulous and organized individual who can effectively manage and update requests, ensuring data quality and contributing to the efficiency of the sales team.…",https://www.adzuna.ca/details/5360014339?utm_medium=api&utm_source=d8fd1a4d,business analyst,ca
Business Analyst,Innovation Federal Credit Union Careers,Canada,2025-08-20T05:59:15Z,,,"Business Analyst Business Analyst will play a pivotal role in understanding and translating business needs into actionable requirements, enabling the successful delivery of digital transformation initiatives. This role involves working closely with stakeholders—including business units, developers, and project managers—to drive business analysis activities on small to medium-sized projects. We’re looking for a Business Analyst to join our team! This position is integral to the function of our o…",https://www.adzuna.ca/details/5359988201?utm_medium=api&utm_source=d8fd1a4d,business analyst,ca
Business Analyst,EFM Element Fleet Management,"Mississauga, Peel region",2025-08-22T05:56:37Z,62600.0,86000.0,"Get started on an exciting career at Element! Element employees make a difference in the lives of others every day. We are re-defining the fleet management industry to be people first, then business – delivering on our promise of a superior client experience. This takes hard work and innovation, and we need more like-minded people on our team. What We Need We are looking for a Business Analyst to join Element Fleet Management. As the largest pure-play fleet manager in the world, we provide unma…",https://www.adzuna.ca/details/5363401029?utm_medium=api&utm_source=d8fd1a4d,business analyst,ca
Business Analyst,Annexit Solutions,"Toronto, Ontario",2025-07-24T21:37:08Z,,,"We are seeking a detail-oriented and analytical Business Analyst to join our team. You will be responsible for bridging the gap between business needs and technology solutions by analyzing processes, identifying requirements, and proposing data-driven improvements. Key Responsibilities: Gather, document, and analyze business requirements from stakeholders. Translate business needs into functional specifications for technical teams. Create detailed business analysis, outlining problems, opportun…",https://www.adzuna.ca/details/5321084856?utm_medium=api&utm_source=d8fd1a4d,business analyst,ca
Business Analyst,Worldhire,"Toronto, Ontario",2025-03-31T13:09:45Z,,,We are looking for a full - time Business Analyst to join one of our Fintech Clients at Toronto location. Main Duties & Responsibilities 1. Understand and review the business requirements and articulate the same into detailed functional specifications and business scenarios 2. Liaise directly with business users from the bank and responsible for end-to-end delivery of the solution scope 3. Support various phases of functional testing 4. Showcase the product and impart training to project stakeh…,https://www.adzuna.ca/details/5119983359?utm_medium=api&utm_source=d8fd1a4d,business analyst,ca
Business Analyst,GFL Environmental Services,Canada,2025-08-03T07:55:34Z,,,"Position Summary GFL Environmental Services is currently seeking a Business Analyst to join our growing Edmonton team. This is an excellent opportunity for a recent graduate, or an early-career professional looking to build experience, expand their skill set, and grow within a dynamic and collaborative organization. As a Business Analyst, you’ll play a key role at the intersection of Finance, IT, and Operations, supporting strategic decision-making and continuous process improvement. You’ll use…",https://www.adzuna.ca/details/5335973342?utm_medium=api&utm_source=d8fd1a4d,business analyst,ca
Business Analyst,Swim Recruiting,"Greater Vancouver, British Columbia",2025-08-13T07:58:31Z,,,"6-month contract Business Analyst role with an enterprise organization investing majorly into technology. 6-month contract Business Analyst role Global enterprise organization In office work environment, 4 days a week in office 1 day remote What & Why: As a result of new projects our client is looking to add a contract business analyst to their growing team. This role is focused on bridging business needs with technical solutions that enhance how wholesale and business partners engage with the …",https://www.adzuna.ca/details/5350416305?utm_medium=api&utm_source=d8fd1a4d,business analyst,ca
Business Analyst,Affinity,"Calgary, Calgary region",2025-07-31T07:35:47Z,,,"Job Description: On behalf of our public sector client, Affinity is looking for a Business Analyst to skilled Business Analyst for a 3-month contract position to support the project within their Medical Program. This hybrid role requires on-site presence 2 days per week in Calgary, with the flexibility to work remotely for the remainder of the time. The ideal candidate will have experience working with clinical stakeholders in a healthcare or medical environment, ensuring project delivery and a…",https://www.adzuna.ca/details/5329700647?utm_medium=api&utm_source=d8fd1a4d,business analyst,ca
Business Analyst,Momentum Financial Services Group,"Toronto, Ontario",2025-05-04T10:18:38Z,,,"Who We Are At Momentum Financial Services Group, we help people move forward by reimagining how money works for those who need it most. With more than 40 years of experience, we’re the team behind Money Mart—Canada’s largest non-bank branch network—and a leader in financial solutions for underserved communities. From short-term loans to money transfers and prepaid cards, we power the products, technology, and operations that connect over a million customers a year to the money they need, when t…",https://www.adzuna.ca/details/5180180493?utm_medium=api&utm_source=d8fd1a4d,business analyst,ca
Business Analyst,Octasic,"Montréal, Québec",2025-08-01T07:35:31Z,,,"Founded in 1998, Octasic is a private company headquartered in Montreal, Canada, with R&D facilities in Canada, USA and India, and a worldwide sales support network. Octasic engineers the wireless edge of modern conflict. Our low-SWaP Software Defined Radios (SDRs), advanced signal processing, and mission-tailored software equip defence, law enforcement, and national security forces to adapt, dominate, and achieve mission success. We Are Looking For a Business Analyst Reporting to the Director …",https://www.adzuna.ca/details/5331889509?utm_medium=api&utm_source=d8fd1a4d,business analyst,ca
Business Analyst,Vivan Ltd,"Uxbridge, Durham region",2025-08-25T00:47:38Z,48776.0,71884.0,"Job Description Job Description Developing technical solutions to business problems, or to advance a company's sales efforts, begins with defining, analyzing and documenting requirements. Managing requirements at the project level can help fulfill business needs. Business analysts typically take the lead role in: Assisting with the business case",https://www.adzuna.ca/details/5367183916?utm_medium=api&utm_source=d8fd1a4d,business analyst,ca
Business Analyst,Visionpool Business Services,Canada,2025-08-22T05:49:30Z,,,"Visionpool Business Services is hiring a HYBRID Business Analyst. Responsibilities: Manage the configuration and lifecycle of key Microsoft 365 applications. Develop and maintain governance policies for Microsoft 365. Develop and recommend Microsoft Teams custom policies, channel structures, and permission settings. Develop conditional access policy user story, user case creation, testing scenarios and results feedback. Support business operations and user adoption across a hybrid IP telephony …",https://www.adzuna.ca/details/5363398644?utm_medium=api&utm_source=d8fd1a4d,business analyst,ca
Business Analyst,Hire DigITalent,"King and Spadina, City of Toronto",2025-07-20T15:28:48Z,,,"Position: Business Application Analyst Fulltime Toronto On-site required Details: One of Hire Digitalent's clients is currently looking for a Business Analyst to join their team. The successful candidate must have experience supporting JD Edwards EnterpriseOne IT projects. Responsibilities: •Collaborate with business stakeholders to elicit, analyze, and document detailed business requirements and functional specification documents for IT projects. •Conduct thorough business process analysis, id…",https://www.adzuna.ca/details/5313588149?utm_medium=api&utm_source=d8fd1a4d,business analyst,ca
Business Analyst,Hire DigITalent,"Toronto, Ontario",2025-08-16T09:44:19Z,,,"Job Description Job Description Position: Business Application Analyst Fulltime Toronto On-site required Details: One of Hire Digitalent's clients is currently looking for a Business Analyst to join their team. The successful candidate must have experience supporting JD Edwards EnterpriseOne IT projects. Responsibilities: •Collaborate with business stakeholders to elicit, analyze, and document detailed business requirements and functional specification documents for IT projects. •Conduct thorou…",https://www.adzuna.ca/details/5355284239?utm_medium=api&utm_source=d8fd1a4d,business analyst,ca
Business Analyst,InnoTech Alberta,"Edmonton, Edmonton region",2025-08-01T07:35:34Z,,,"InnoTech Alberta is seeking a Business Analyst who will play a critical role in advancing strategic and operational priorities through structured business analysis, project management, stakeholder engagement, and cross-functional coordination. With a strong focus on business process improvement, performance measurement, and service delivery optimization, the Business Analyst helps translate organizational needs into actionable plans that support enterprise objectives. Based in our Edmonton Rese…",https://www.adzuna.ca/details/5331889978?utm_medium=api&utm_source=d8fd1a4d,business analyst,ca
Business Analyst,Orion Health,"Toronto, Ontario",2025-08-01T07:35:32Z,,,"Innovate With Purpose Do you want to work for a company that is innovating and making a difference to the health and wellbeing of people all over the world? We’re not about selling meaningless, unnecessary products for corporate profitability. You’ll be working on technology that will revolutionise global health systems so that we can finally get the healthcare we all want - a basic human right. We like to think of ourselves as a community of start-ups where you can be your true, genuine self. …",https://www.adzuna.ca/details/5331889685?utm_medium=api&utm_source=d8fd1a4d,business analyst,ca
Business Analyst,2iSolutions Inc.,"Regina region, Saskatchewan",2025-08-22T06:52:52Z,,,"If interested, please share your resume at: pragathi.thalur@2iresourcing.ca Job Title: Business Analyst Duration: 1.5 years Location: Regina, SK Must Haves Collaborate with IT and vendor teams to configure and maintain Cisco Contact Centre solutions, including call routing logic, agent skill groups, and queue management. Participate in vendor evaluation and rollout of SmartTAP recording solutions, ensuring compliance with enterprise call recording policies and regulatory standards. Serve as lia…",https://www.adzuna.ca/details/5363424454?utm_medium=api&utm_source=d8fd1a4d,business analyst,ca
Business Analyst,The Siroky Group Inc.,"Thornhill, York region",2025-08-10T02:48:51Z,65000.0,85000.0,"Job Description Job Description The Siroky Group We are in the business of creating and implementing software and business solutions for our clients. Our team members are of the highest quality and maintain a wide range of skills and tools. We are a small but nimble organization, working with both large and small organizations in order to bridge the gap between technology and business. Description We are looking for an Intermediate Business Analyst to join our group of skilled professionals. A …",https://www.adzuna.ca/details/5346617692?utm_medium=api&utm_source=d8fd1a4d,business analyst,ca
Business Analyst,Ideal,Canada,2024-07-30T17:38:53Z,,,"Job Title: Professional - Business Analyst - Consultant Line of Business: Commercial Banking & Wealth Management Number of Positions Requested: 1 Work location: 18 York Street Target Start Date: ASAP End Date or Tenure/Duration: 6 months Rate: $95.00 Possibility of Extension/Conversion: Extension is very likely but will depend on candidate performance and available funding and workload. Availability to Interview (date & times): ASAP Work Schedule: Hours: 40/hr 9-5pm · OT: Possible, however the …",https://www.adzuna.ca/details/4801479758?utm_medium=api&utm_source=d8fd1a4d,business analyst,ca
Business Analyst,Velixo,"Montréal, Québec",2025-08-16T05:52:31Z,,,"Velixo is an award-winning leader in Excel-based reporting, planning, and automation solutions tailored for prominent cloud ERP platforms including Acumatica, Sage Intacct, and Microsoft Dynamics 365 Business Central. Our headquarters is located in Montreal, Canada, complemented by a globally-distributed, fully remote R&D team. At Velixo, we pride ourselves on delivering user-friendly, efficient solutions loved by customers, earning top ratings on marketplaces and G2. Who We're Looking For: We …",https://www.adzuna.ca/details/5355144910?utm_medium=api&utm_source=d8fd1a4d,business analyst,ca
ICT BUSINESS ANALYSTS,Royal International Commerce Pty Ltd,"Matraville, Eastern Suburbs",2025-08-13T09:11:18Z,80000.0,100000.0,"Royal International Commerce Pty Ltd (ABN 68605424851), a leading importer and distributor of fresh European and international food, is seeking a Supply Chain Analyst for a full-time, permanent position. Royal focuses on B2B relationships, supplying major Australian retailers and leading food distributors. Its product range includes over 100 cheeses, numerous types of smallgoods, and a variety of gourmet items imported from across Europe (including Italy, France, Spain, the United Kingdom, Swit…",https://www.adzuna.com.au/details/5349884091?utm_medium=api&utm_source=d8fd1a4d,business analyst,au
Business Analyst Consultant (Energy Sector),Energy focus sem,"Stirling, Adelaide Hills",2025-08-28T10:50:13Z,70000.0,79000.0,"About the Role As a Business Consultant you will work closely with our director, clients, and contractors to deliver technology-enabled energy solutions. You will analyse energy and business data, identify process improvements, and provide valuable insights that support smarter energy management and decision-making. This opportunity will be offered on a Permanent Full-Time basis. Key Responsibilities ● Analyse and interpret data from NMI meters, BMS systems, MSATS, and other platforms. ● Conduc…",https://www.adzuna.com.au/details/5371168810?utm_medium=api&utm_source=d8fd1a4d,business analyst,au
Senior Business Analyst,Talenza,"The Rocks, Sydney",2025-08-19T17:29:53Z,150.0,200.0,"Senior Business Analyst This range is provided by Talenza. Your actual pay will be based on your skills and experience — talk with your recruiter to learn more. Base pay range A$900.00/daily - A$950.00/daily Direct message the job poster from Talenza Talenza has been engaged by one of Australia's financial services providers to source to a Senior Business Analyst with expertise in complex transformations. 12M contract | Up to $950  super p.d Requirements: 6 years in business analysis, with expe…",https://www.adzuna.com.au/land/ad/5358483378?se=bhXYALmE8BGkMMRxZtLABA&utm_medium=api&utm_source=d8fd1a4d&v=ADA13F403719E989B98F237B457EE09C955911F9,business analyst,au
Senior Business Analyst,Public Sector People,"The Rocks, Sydney",2025-08-29T10:43:48Z,150.0,200.0,2 days ago Be among the first 25 applicants Business Analyst – 6 Month Contract Public Sector People have partnered with a Sydney-based Council to recruit an experienced Business Analyst – 6 Month Contract Public Sector People have partnered with a Sydney-based Council to recruit an experienced Business Analyst for a 6-month contract . This is an exciting opportunity to play a pivotal role in helping deliver a key TechnologyOne implementation project. You’ll work closely with stakeholders to an…,https://www.adzuna.com.au/land/ad/5372863005?se=bhXYALmE8BGkMMRxZtLABA&utm_medium=api&utm_source=d8fd1a4d&v=93523B541A1386DEF80921AAA872B679628C9316,business analyst,au
Senior Business Analyst,Clicks IT Recruitment,"The Rocks, Sydney",2025-08-29T10:43:57Z,150.0,200.0,Join to apply for the Senior Business Analyst role at Clicks IT Recruitment Join to apply for the Senior Business Analyst role at Clicks IT Recruitment Get AI-powered advice on this job and more exclusive features. Clicks IT Recruitment provided pay range This range is provided by Clicks IT Recruitment. Your actual pay will be based on your skills and experience — talk with your recruiter to learn more. Base pay range A$900.00/yr - A$970.00/yr About the Role My client is seeking a Senior Busine…,https://www.adzuna.com.au/land/ad/5372863177?se=bhXYALmE8BGkMMRxZtLABA&utm_medium=api&utm_source=d8fd1a4d&v=E77C8A3DB7E1FD0E6107BEAFA77529A6ADF1B1D6,business analyst,au
Senior Business Analyst,NSW Department of Communities and Justice,"The Rocks, Sydney",2025-08-18T16:51:08Z,150.0,200.0,"Join to apply for the Senior Business Analyst role at NSW Department of Communities and Justice Join to apply for the Senior Business Analyst role at NSW Department of Communities and Justice Senior Business Analyst - NSW Trustee and Guardian Ongoing full-time vacancy – 35 hours per week. Location: This role is based in Sydney. Flexible and hybrid working options available. Clerk Grade: 9/10. Base salary $129,464 to $142,665 p.a. plus super and annual leave loading. This is an opportunity to jo…",https://www.adzuna.com.au/land/ad/5357166687?se=bhXYALmE8BGkMMRxZtLABA&utm_medium=api&utm_source=d8fd1a4d&v=DA55E66EC4F1BCD721B3458115DD8E1D2CC6F5D1,business analyst,au
Senior Business Analyst,EML Group,"The Rocks, Sydney",2025-08-25T18:26:06Z,150.0,200.0,"Join to apply for the Senior Business Analyst role at EML Group Join to apply for the Senior Business Analyst role at EML Group EML is a leading Workers Compensation and Personal Injury Claims Management business. Our goal is to help people get their lives back through ongoing support during their return-to-work journey . We continue to experience ongoing growth and now have over 4,000 dedicated employees . We foster a learning culture that allows for us to continually invest in our employees e…",https://www.adzuna.com.au/land/ad/5367374337?se=bhXYALmE8BGkMMRxZtLABA&utm_medium=api&utm_source=d8fd1a4d&v=0E0F20C1FB5D022D3AD72A514946CCCBA78074C4,business analyst,au
Senior Business Analyst,FinXL,"The Rocks, Sydney",2025-08-26T18:45:40Z,150.0,200.0,"Business Analyst - Insurance Location : Sydney or Brisbane (preferred) Contract Duration: 6 months FinXL Professional Services is a leading provider of technology and business consulting solutions across Australia. We connect top-tier consultants with challenging and rewarding client assignments. About the Role: FinXL is seeking 2 experienced Business Analysts to join our Commercial team. This role focuses on supporting the release of new insurance products and defining the impacts on systems, …",https://www.adzuna.com.au/land/ad/5368736447?se=bhXYALmE8BGkMMRxZtLABA&utm_medium=api&utm_source=d8fd1a4d&v=A19C8B12042F7836143BF6F0E54EE5A7774F79CE,business analyst,au
Senior Business Analyst,Australian Payments Plus,"The Rocks, Sydney",2025-08-21T17:57:52Z,150.0,200.0,"The Game Changers: Australian Payments Plus (AP) is here to shape the future of payments for Australia. We aim to deliver more innovation to Australia’s payments ecosystem, for the collective benefit of Australian businesses, government and consumers. Our solutions include Australia’s domestic debit network, real-time, data rich payments infrastructure, secure bill payments, digital identity verification, QR payments and experiences and open wallet solutions. It’s a new chapter with more possib…",https://www.adzuna.com.au/land/ad/5361796998?se=bhXYALmE8BGkMMRxZtLABA&utm_medium=api&utm_source=d8fd1a4d&v=CA9ECA3B3E9E91FC80E177E16503178A3A3166E5,business analyst,au
Senior Business Analyst,Talenza,"The Rocks, Sydney",2025-08-28T10:39:18Z,150.0,200.0,"Senior Business Analyst Direct message the job poster from Talenza The Business Analyst will contribute to the corporate technology portfolio by providing analysis expertise to process, people and technologies including idea shaping and cost analysis. Reporting to the IT Director , the role will deliver / support to deliver : 1. Expert analysis across process, people and technology 2. Idea shaping including problem statement definition and technology application assessment identifying solution …",https://www.adzuna.com.au/land/ad/5371158045?se=bhXYALmE8BGkMMRxZtLABA&utm_medium=api&utm_source=d8fd1a4d&v=81D1C077E0FFF174B69416D7AD7BBF30E905E184,business analyst,au
Senior Business Analyst,GBST,"The Rocks, Sydney",2025-08-27T18:34:30Z,150.0,200.0,"Join to apply for the Senior Business Analyst role at GBST Join to apply for the Senior Business Analyst role at GBST At GBST, we’re inspiring wealth innovation for wealth management and advice organizations globally. Our commitment to excellence, our track record of continued and successful delivery, and our hard work and product excellence has earned us the trust and partnership of hundreds of the world’s leading financial services organizations. We’ve invested heavily in transforming our tec…",https://www.adzuna.com.au/land/ad/5370083196?se=bhXYALmE8BGkMMRxZtLABA&utm_medium=api&utm_source=d8fd1a4d&v=E70A129EA152B691BD6F41F55B5B2AEB368533EB,business analyst,au
