title,company,location,created,salary_min,salary_max,description,redirect_url,search_role,search_country
Data Scientist,Jerry.ai,"Los Angeles, Los Angeles County",2025-08-29T02:06:14Z,191345.44,191345.44,"Job Description Job Description You could be a data scientist anywhere. Why us? Join a pre-IPO startup with capital, traction and runway ($240M funded | 60X revenue growth in 5 years | $2T market size) Partner with our VP of Data Science & Analytics, Armando La Rocca (ex-BCG, Better) Disrupt a massive market and take us to a $10B business in the next few years Be immersed in a talent-dense environment and greatly accelerate your career growth About the opportunity: Jerry is looking for a Data s…",https://www.adzuna.com/land/ad/5373147783?se=xjAz7LiE8BGkMMRxZtLABA&utm_medium=api&utm_source=d8fd1a4d&v=0BC1F9FE92510979618AA301EB0398FA2BEC9545,data scientist,us
Data Scientist,Jerry.ai,"Richmond City, Richmond County",2025-08-29T02:05:31Z,175486.5,175486.5,"Job Description Job Description You could be a data scientist anywhere. Why us? Join a pre-IPO startup with capital, traction and runway ($240M funded | 60X revenue growth in 5 years | $2T market size) Partner with our VP of Data Science & Analytics, Armando La Rocca (ex-BCG, Better) Disrupt a massive market and take us to a $10B business in the next few years Be immersed in a talent-dense environment and greatly accelerate your career growth About the opportunity: Jerry is looking for a Data s…",https://www.adzuna.com/land/ad/5373147182?se=xjAz7LiE8BGkMMRxZtLABA&utm_medium=api&utm_source=d8fd1a4d&v=A0B6FCFE45004334994B9B1403C5280F95978781,data scientist,us
Data Scientist,Rev.io,"Atlanta, Fulton County",2025-08-21T13:30:53Z,131517.83,131517.83,"Job Description Job Description About Rev.io Rev.io provides configurable software for billing, customer management, business management, payments, analytics, provisioning, and automation to service providers in telecommunications, Wireless & IoT, managed IT services, A/V, security integration, and other related industries. Our modern, cloud-based software delivers the industry’s most complete quote-to-cash experience, enabling our clients to grow their revenue efficiently. Rev.io is an Atlanta…",https://www.adzuna.com/land/ad/5362127175?se=xjAz7LiE8BGkMMRxZtLABA&utm_medium=api&utm_source=d8fd1a4d&v=88F1922025D4B8C6EE55779F19CDD07513D43029,data scientist,us
Data Scientist,Autonomous Solutions,"Mendon, Cache County",2025-08-21T13:32:03Z,174558.78,174558.78,"Job Description Job Description At ASI, we are revolutionizing industries with state-of-the-art autonomous robotics solutions. We deliver technologies that enhance safety, productivity, and efficiency. With our core values of Simplicity , Safety , Transparency , Humility , Attention to Detail and Growth guiding everything we do, we're shaping the future of automation in dynamic markets. As a Data Scientist, you will play a key role in advancing ASI's industry-leading autonomous systems by trans…",https://www.adzuna.com/land/ad/5362129303?se=xjAz7LiE8BGkMMRxZtLABA&utm_medium=api&utm_source=d8fd1a4d&v=728F38A4913F06921067B5F6EA4578A7511F6568,data scientist,us
Data Scientist,Rentable,"Madison, Dane County",2025-08-21T13:31:12Z,140636.7,140636.7,"Job Description Job Description We're Changing the Rentals Industry We're a profitable, growth-stage company building industry-leading martech and data products for the rentals industry. While originally known for building and operating one of the U.S.'s largest rental marketplaces - Rentable, our focus has shifted to our category-leading AI and data SaaS products with triple-digit growth rates. We're a fully remote team of 100 spread across the U.S. from coast to coast. We operate on a strict …",https://www.adzuna.com/land/ad/5362127703?se=xjAz7LiE8BGkMMRxZtLABA&utm_medium=api&utm_source=d8fd1a4d&v=DC16C1262DEE3EFC21ED7B4E92D5223D859697FE,data scientist,us
Data Scientist,Talent Navigation Experts,"Denver, Colorado",2025-08-12T12:55:17Z,114044.54,114044.54,"Job Description Job Description Company Description Talent Navigation Experts is a boutique staffing firm in Denver, delivering all of your recruiting needs. We’re more than just headhunters; we provide best-in-class service for both Denver companies and the top talent they want to recruit. Job searches can be difficult, both for companies and candidates. At Talent Navigation Experts, we guide Denver companies through the recruiting process with a customized staffing model built just for them. …",https://www.adzuna.com/land/ad/5349146492?se=xjAz7LiE8BGkMMRxZtLABA&utm_medium=api&utm_source=d8fd1a4d&v=E55B01BFECF7EA29CDA2CAC0C78478F44EE1C1BB,data scientist,us
Data Scientist,"Buyers Edge Platform, LLC","Lake Worth, Palm Beach County",2025-08-02T11:42:31Z,122099.91,122099.91,"Job Description Job Description We are seeking a highly skilled Data Scientist to lead the development of demand prediction models that help restaurant operators make smarter ordering decisions. In this role, you'll work with large-scale purchasing and operational data to deliver accurate, timely, and actionable forecasts that directly impact efficiency, revenue, and customer satisfaction. You'll be a core member of our data science team, applying advanced time series methods and machine learni…",https://www.adzuna.com/land/ad/5334573291?se=xjAz7LiE8BGkMMRxZtLABA&utm_medium=api&utm_source=d8fd1a4d&v=1B03911F10F0DE3455EC1179F529FA7BB68D7221,data scientist,us
Data Scientist,Parafin,"San Francisco, California",2025-08-12T12:55:29Z,171173.86,171173.86,"Job Description Job Description About Us: At Parafin, we’re on a mission to grow small businesses. Small businesses are the backbone of our economy, but traditional banks often don’t have their backs. We build tech that makes it simple for small businesses to access the financial tools they need through the platforms they already sell on. We partner with companies like DoorDash, Amazon, Worldpay, and Mindbody to offer fast and flexible funding, spend management, and savings tools to their small…",https://www.adzuna.com/land/ad/5349146652?se=xjAz7LiE8BGkMMRxZtLABA&utm_medium=api&utm_source=d8fd1a4d&v=85959F009978E4A3AD2EF40C1776B3DBE310F039,data scientist,us
Data Scientist,Applied Physics,"New York City, New York",2025-08-24T01:48:08Z,146988.75,146988.75,"Job Description Job Description Applied Physics is seeking a Data Scientist experienced with a diverse array of data types to join our dynamic and multidisciplinary team of independent and entrepreneurial computer scientists and engineers. In this role, you will collaborate with scientists and researchers in various areas, including data analysis, compression, text processing, graph analysis, machine learning, information visualization, as well as others. Responsibilities: Collaborate with scie…",https://www.adzuna.com/land/ad/5366420458?se=xjAz7LiE8BGkMMRxZtLABA&utm_medium=api&utm_source=d8fd1a4d&v=11DDCBFBF92A2D4CA40B7CE9AFDB2760D325B24F,data scientist,us
Data Scientist,Padmore Global Connections LLC,"Atlanta, Fulton County",2025-08-29T00:22:53Z,150031.28,150031.28,"Job Description Job Description Max Pay Rate: $75.26 Work Arrangement: Hybrid Agency Interview Type: Web Cam Interview Only Engagement Type: Contract NOTE : Applications with resumes in PDF Format will be automatically rejected. Only Word format resumes will be considered. Short Description: In this role, you will analyze large and/or complex datasets, develop predictive models, and derive actionable insights that drive key business decisions. Complete Description: We are seeking a highly analy…",https://www.adzuna.com/land/ad/5373058946?se=xjAz7LiE8BGkMMRxZtLABA&utm_medium=api&utm_source=d8fd1a4d&v=75EA0D6D1E80B0398D1D80619E2CF6033918CD4B,data scientist,us
Data Scientist,Unified,"New York City, New York",2025-08-24T13:47:39Z,118906.91,118906.91,Job Description Job Description Who you are: You enjoy building machine learning models and doing advanced statistical analyses. You enjoy combing through large data sets and finding patterns within the noise. You’re autonomous and able to acquire new skills to solve a problem. You’re always looking to innovate current processes and you get excited when tackling problems you haven’t seen before. You have a strong analytics and programming background and are ready to start applying this to the w…,https://www.adzuna.com/land/ad/5366650655?se=xjAz7LiE8BGkMMRxZtLABA&utm_medium=api&utm_source=d8fd1a4d&v=70C5098A33588F9515D93630C9FF28A4F8F0B674,data scientist,us
Data Scientist,RMA Associates LLC,"Arlington, Arlington County",2025-08-27T01:56:54Z,91908.33,91908.33,"Job Description Job Description IMPORTANT NOTE: This position requires a valid and current Secret Clearance At RMA, we exceed the traditional role of a CPA and consulting firm. We are a team of seasoned professionals deeply committed to empowering our Federal Government clients to achieve their missions, improve operational efficiency, and deliver tangible value to our citizens. Our expertise lies in tailoring our services to meet unique needs. As trusted, value-added advisors, our unwavering c…",https://www.adzuna.com/land/ad/5369987907?se=xjAz7LiE8BGkMMRxZtLABA&utm_medium=api&utm_source=d8fd1a4d&v=12835AB60176351DD6B6D3CDDE960229F81D42F6,data scientist,us
Data Scientist,SierTeK Ltd.,"Dayton, Montgomery County",2025-08-16T13:26:41Z,129910.87,129910.87,"Job Description Job Description SierTeK proudly serves our clients by providing expertise in the Program Management, Information Technology, and Administrative Support domains. Founded in 2007 as a minority and service-disabled veteran-owned company, we serve as prime- and subcontractor for a multitude of Federal Department of Defense contracts. By focusing on continual improvement, our services remain at the forefront of our industry, and we pride ourselves on delivering our services with the …",https://www.adzuna.com/land/ad/5355384634?se=xjAz7LiE8BGkMMRxZtLABA&utm_medium=api&utm_source=d8fd1a4d&v=AAF2713CF91717F9CD4FC6FC95E0B16E64BC7E52,data scientist,us
Data Scientist,Apogee Integration LLC,"Chantilly, Fairfax County",2025-08-21T13:31:27Z,200070.23,200070.23,"Job Description Job Description Salary: Security Clearance: Active TS/SCI with FS Polygraph required Position Seeking a Data Scientist to support an Intelligence Client. What You'll Do Assemble large, complex sets of data to meet functional and other requirements Build models, test hypotheses, interpret, summarize, visualize, and succinctly report on data findings Construct and perform complex database search queries in multiple databases using SQL and API interfaces Curate and maintain data st…",https://www.adzuna.com/land/ad/5362128143?se=xjAz7LiE8BGkMMRxZtLABA&utm_medium=api&utm_source=d8fd1a4d&v=36A7E3EEA296F822CBA478095196CC5BDB7C6728,data scientist,us
Data Scientist,Harris-Stowe State University,"Saint Louis, Saint Louis County",2025-07-31T23:39:19Z,92403.48,92403.48,"Job Description Job Description Harris-Stowe State University is a historically Black institution (HBCU) located in the heart of vibrant mid-town St. Louis, Missouri. Harris-Stowe’s beautiful campus is minutes from the renown Gateway Arch, St. Louis Zoo, St. Louis Art and History Museums, Forest Park and other cultural and educational institutions. Harris-Stowe’s diverse faculty and staff provide a wide range of academic programs to one of the most culturally diverse student bodies in the St. L…",https://www.adzuna.com/land/ad/5331206705?se=xjAz7LiE8BGkMMRxZtLABA&utm_medium=api&utm_source=d8fd1a4d&v=F066781E9F8B191650318FF716798B2ED96A2394,data scientist,us
Data Scientist,4P Consulting Inc.,"Atlanta, Fulton County",2025-08-29T00:10:23Z,104504.74,104504.74,"Job Description Job Description 5-10 Years This role is for someone with advanced data analysis skills and a firm grasp of the scientific method. Must be proficient in statistics and at least one programming language (typically R or Python). Responsibilities include data wrangling, data analysis, and data exploration. Should be familiar with a variety of Machine Learning algorithms and big data processing frameworks. In addition to building machine learning and other statistical models, will be…",https://www.adzuna.com/land/ad/5373053423?se=xjAz7LiE8BGkMMRxZtLABA&utm_medium=api&utm_source=d8fd1a4d&v=7E5A70585B55F95F2E8A86C99937650F19AB16DA,data scientist,us
Data Scientist/Senior Data Scientist,Knowli Corp dba Knowli Data Science,"Tallahassee, Leon County",2025-08-02T11:47:52Z,123370.83,123370.83,"Job Description Job Description Knowli Data Science is looking for experienced data scientists to join our nationally growing team. The ideal candidate should have a degree in mathematics, computer science, physics, statistics, quantitative social science, or similar field and at least 3 years of experience working in data analytics, data visualization, or data science roles. Familiarity with programming for data analysis is required; preferably, SQL, Python, and R. Experience with machine lear…",https://www.adzuna.com/land/ad/5334577369?se=xjAz7LiE8BGkMMRxZtLABA&utm_medium=api&utm_source=d8fd1a4d&v=D9746214A7561935D4E1423EF2E369989EB9566E,data scientist,us
Data Scientist (Senior),Vector CSP LLC,US,2025-08-27T13:54:04Z,123148.43,123148.43,"Job Description Job Description Job Summary: Lead the development and implementation of advanced analytics models, solutions and data analysis and predictive modeling efforts. Use expertise in statistics, machine learning, and analytical approaches to generate actionable insights. Apply advanced knowledge in statistics, machine learning, and programming languages to discover insights, solve complex business challenges and build predictive models. This position is not remote and is in office on …",https://www.adzuna.com/land/ad/5370472453?se=xjAz7LiE8BGkMMRxZtLABA&utm_medium=api&utm_source=d8fd1a4d&v=1392684383EC09862A0D78BE97424158E223CDE1,data scientist,us
Data Scientist,CloudTech Innovations,"Boston, Suffolk County",2025-08-20T11:51:06Z,177711.27,177711.27,"Job Description Job Description Job Title: Data Scientist – Machine Learning, Big Data, GenAI (8–10 Years Experience) Location: Remote Employment Type: Contract About the Role We are seeking a highly experienced Data Scientist with 8–10 years of expertise delivering production-grade AI/ML solutions at scale. This role requires deep technical proficiency in Machine Learning, Big Data, Generative AI, Large Language Models (LLMs), and Retrieval-Augmented Generation (RAG) , combined with hands-on c…",https://www.adzuna.com/land/ad/5360306542?se=xjAz7LiE8BGkMMRxZtLABA&utm_medium=api&utm_source=d8fd1a4d&v=2E2DFE3A2D001764FCE77423A09B1F5F994A3D24,data scientist,us
Data Scientist,Figma,"Hayes Valley, San Francisco",2025-07-31T10:18:39Z,198811.67,198811.67,"Figma is growing our team of passionate creatives and builders on a mission to make design accessible to all. Figma’s platform helps teams bring ideas to life—whether youre brainstorming, creating a prototype, translating designs into code, or iterating with AI. From idea to product, Figma empowers teams to streamline workflows, move faster, and work together in real time from anywhere in the world. If youre excited to shape the future of design and collaboration, join us! We are looking for an…",https://www.adzuna.com/details/5329831928?utm_medium=api&utm_source=d8fd1a4d,data scientist,us
Data Scientist,Robert Half,"Houston, Houston County",2025-08-15T03:04:28Z,104000.0,112320.0,"Job Description Job Description Job Description: Technical Analyst – Data Science We are seeking a highly analytical and technically skilled Technical Analyst – Data Science to support business needs through data analysis, solution development, and collaboration with cross-functional teams. This role blends technical expertise with business acumen to deliver impactful insights and scalable data solutions. WKey Responsibilities: Analyze business processes and translate requirements into technica…",https://www.adzuna.com/land/ad/5353471092?se=xjAz7LiE8BGkMMRxZtLABA&utm_medium=api&utm_source=d8fd1a4d&v=78825D5169DE2429223127AE6EA1E7FC398741F1,data scientist,us
Data Scientist,World Services LLC,"Washington, Washington, D.C.",2025-08-05T23:27:57Z,136333.16,136333.16,"Job Description Job Description Job Title: Data Scientist Location: Remote Clearance: U.S. Citizenship Required; Ability to Obtain Public Trust Clearance Position Type: Full-Time Position Overview We are seeking a skilled and motivated Data Scientist to support a federal government program focused on applying advanced analytics, machine learning, and generative AI technologies to modernize digital services, optimize decision-making, and automate workflows. The ideal candidate will have experien…",https://www.adzuna.com/land/ad/5339518829?se=xjAz7LiE8BGkMMRxZtLABA&utm_medium=api&utm_source=d8fd1a4d&v=2D6E197D20D90FBCA322AF15DA2E060A9B162CDF,data scientist,us
Data Scientist,Robert Half,"Glendale, Maricopa County",2025-08-07T03:12:37Z,176800.0,187200.0,"Job Description Job Description We are looking for an experienced Data Scientist to join our team in Glendale, CA, on a long-term contract basis. This role is ideal for a detail-oriented individual with a deep understanding of data science principles, machine learning methodologies, and statistical analysis, who thrives in a dynamic and collaborative environment. If you are skilled in leveraging advanced tools and technologies to drive data-driven insights, we invite you to apply. Responsibilit…",https://www.adzuna.com/land/ad/5341484352?se=xjAz7LiE8BGkMMRxZtLABA&utm_medium=api&utm_source=d8fd1a4d&v=EF9234A148BC16A226E52A17257D5BCAF9BED382,data scientist,us
Data Scientist,Oxefit Inc,"Plano, Collin County",2025-08-22T11:25:39Z,104824.95,104824.95,"Job Description Job Description Salary Range: Based on experience As a Data Scientist, you will have the opportunity to build and develop models for data processing and analytics related to strength training and fitness. Essential Functions: Work with subject matter experts in fitness and strength training to develop metrics and analytics Help identify and solve complex and interesting data science problems Participate in data quality strategy discussions and implement layers of the test pyrami…",https://www.adzuna.com/land/ad/5363838047?se=xjAz7LiE8BGkMMRxZtLABA&utm_medium=api&utm_source=d8fd1a4d&v=2DBB60AB90341430CD2A009E387C64E07E09D61B,data scientist,us
Data Scientist,NS2 Mission,"Washington, Washington, D.C.",2025-07-31T23:07:52Z,103985.5,103985.5,"Job Description Job Description Are you passionate about working on a small, impactful team where your contributions directly influence mission success? Do you thrive on developing applications that leverage high-value data for critical insights? NS2 Mission is looking for a highly motivated, self-driven Data Scientist to join our team in Northern Virginia. Your work will involve creating innovative data solutions, enhancing workflows, and unlocking the potential of complex datasets. This posit…",https://www.adzuna.com/land/ad/5331150343?se=xjAz7LiE8BGkMMRxZtLABA&utm_medium=api&utm_source=d8fd1a4d&v=5A652295948319937956C47C2A140771C7ACAD92,data scientist,us
Data Scientist,Bay Area Environmental Research Institute,"Mountain View, Santa Clara County",2025-08-26T11:20:28Z,133493.53,133493.53,"Job Description Job Description The Bay Area Environmental Research (BAER, https://baeri.org/) Institute, a 501(c)(3) nonprofit organization focused on enabling and conducting research in Earth and space science, is seeking a Data Scientists for the NASA Ames Earth Science Division (https://www.nasa.gov/earth -science-at-ames/). The positions will work for the Wildfire, Ecosystem Resilience, and Risk Assessment Initiative (WERK) that aims to develop ecosystem monitoring data products and assess…",https://www.adzuna.com/land/ad/5368925757?se=xjAz7LiE8BGkMMRxZtLABA&utm_medium=api&utm_source=d8fd1a4d&v=1FF50CC86A253AAE8AAF36E7BD7FB341EE695E07,data scientist,us
Sr. Data Scientist,ARC Group,"Atlanta, Fulton County",2025-08-28T14:01:36Z,110787.77,110787.77,"Job Description Job Description Sr. Data Scientist (100% remote) ARC Group is currently seeking a Sr. Data Scientist to join a global leader in shipping and enterprise logistics services. The Data Scientist will be an integral part in helping the organization by working with numerous departments to develop solutions for customers, make sure products are as needed, and that quality and performance of products are met. This is NOT a junior position nor a developer role , it is a need for a Data S…",https://www.adzuna.com/land/ad/5371978029?se=xjAz7LiE8BGkMMRxZtLABA&utm_medium=api&utm_source=d8fd1a4d&v=E2244D702DECA844138053FDF177B52323365716,data scientist,us
Principal Data Scientist,MediaAlpha,"Los Angeles, Los Angeles County",2025-08-24T01:45:53Z,209628.42,209628.42,"Job Description Job Description MediaAlpha is a customer acquisition solutions provider powered by technology and data science. The company provides industry-leading solutions designed to reach consumers shopping within high-consideration categories such as property and casualty insurance, health insurance, life insurance, and more. Hybrid: Tuesday & Wednesday in-office Role Overview Our Principal Data Scientist will own the highest-stakes problems across our marketplace while partnering direct…",https://www.adzuna.com/land/ad/5366419180?se=xjAz7LiE8BGkMMRxZtLABA&utm_medium=api&utm_source=d8fd1a4d&v=718EBE9C978C584513AC4A7BB9587F88D0EC17C3,data scientist,us
Senior Data Scientist,VANGUARD CHARITABLE ENDOWMENT PROGRAM,"Malvern, Chester County",2025-08-03T11:47:27Z,125904.45,125904.45,"Job Description Job Description Position Senior Data Scientist – Marketing Reports to Data Science Manager Summary We are seeking a highly skilled and motivated Senior Data Scientist - Marketing to join our team. This role will be pivotal in directing the setup of our marketing data analytics infrastructure, focusing on attribution, ROI, web analytics, and experimentation. The ideal candidate will work closely with our data engineering team to develop and implement data science products that en…",https://www.adzuna.com/land/ad/5336110766?se=xjAz7LiE8BGkMMRxZtLABA&utm_medium=api&utm_source=d8fd1a4d&v=F558E036A96ABECBF28EF15987817534B99EA009,data scientist,us
Data Scientist 1,4P Consulting Inc.,"Atlanta, Fulton County",2025-08-29T00:22:45Z,125777.71,125777.71,"Job Description Job Description Job Description : 4P Consulting Inc. is seeking a highly skilled Data Scientist to join our team. As a Data Scientist, you will leverage your expertise in data analysis and machine learning to extract valuable insights, solve complex problems, and support data-driven decisions. You will work with large datasets to drive innovation and help organizations improve performance across a variety of industries, including finance, healthcare, and technology. Key Responsi…",https://www.adzuna.com/land/ad/5373058502?se=xjAz7LiE8BGkMMRxZtLABA&utm_medium=api&utm_source=d8fd1a4d&v=A57D34B90789ED030B0AE36D00827801489FD6F6,data scientist,us
Sr. Data Scientist,TechOp Solutions International,"Tampa, Hillsborough County",2025-08-17T01:05:58Z,164244.17,164244.17,"Job Description Job Description We are seeking a talented and experienced Sr. Data Scientist to join our team. As a Data Scientist, you will play a crucial role in designing, developing, and implementing data science solutions to empower investigators and enhance our capabilities in extracting meaningful information and identifying anomalous patterns of activity. Responsibilities: Collaborate with subject matter experts, team leads, and third-party vendors to define new features and functions f…",https://www.adzuna.com/land/ad/5356300080?se=xjAz7LiE8BGkMMRxZtLABA&utm_medium=api&utm_source=d8fd1a4d&v=6ED8B1480FF39F2274981F1D2D887B058285FE77,data scientist,us
Senior Data Scientist,Kros-Wise,"San Diego, San Diego County",2025-08-24T13:44:27Z,146562.94,146562.94,"Job Description Job Description We are seeking a highly experienced Senior Data Scientist to lead advanced analytics, machine learning model development, and data-driven decision support within a Department of Defense (DoD) program environment. This role involves architecting and deploying end-to-end data solutions that enhance operational effectiveness, readiness forecasting, and mission-critical insights for Navy enterprise systems. Key Responsibilities Design, develop, and deploy predictive …",https://www.adzuna.com/land/ad/5366647697?se=xjAz7LiE8BGkMMRxZtLABA&utm_medium=api&utm_source=d8fd1a4d&v=BD018BDC33C55B87CAEC20507842806572C1F1E6,data scientist,us
Senior Data Scientist,Barbaricum,"Falls Church City, Virginia",2025-08-19T01:15:48Z,222516.72,222516.72,"Job Description Job Description Barbaricum is a rapidly growing government contractor providing leading-edge support to federal customers, with a particular focus on Defense and National Security mission sets. We leverage more than 17 years of support to stakeholders across the federal government, with established and growing capabilities across Intelligence, Analytics, Engineering, Mission Support, and Communications disciplines. Founded in 2008, our mission is to transform the way our custome…",https://www.adzuna.com/land/ad/5358395428?se=xjAz7LiE8BGkMMRxZtLABA&utm_medium=api&utm_source=d8fd1a4d&v=5EC603F287DA45CAB726AF3C796182620C1D7ECB,data scientist,us
